"2017/01/25 9:53:20 pm CET","6","6","6","[Pipe dreams] Finally a pleasant and relevant subject to work on ! ","3","4","6","La matière est toute à fait pertinente, mais la manière dont elle est enseignée n'est pas attrayante, on ne fait que lire des diapositives trop chargées, et il a fallu insister plusieurs fois afin d'avoir des TPs dans cette matière, car ils n'étaient pas prévus au départ (alors qu'ils apportent un réel plus à la matière !)","6","4","6","Très pertinentes, ces conférences sont à mes yeux un excellent moyen de voir concrètement les possibilités qui s'offrent à nous après le diplôme.","4","4","2","La pertinence de cet enseignement est grandement questionnable, étant donné l'énorme redondance avec le module CECA de deuxième année ! Premièrement les compétences abordées dans ce module sont bien moins exploitées que dans le module CECA, qui est plus complet et plus productif, il n'apporte donc presque rien à ceux qui ont fait CECA (comme moi). De plus, pour ceux qui n'ont pas pris CECA en 2A, c'est leur imposer un travail qui visiblement ne les intéresse pas, sur une thématique imposée, il me semble clairement que la pédagogie de ce module est à revoir.

Je salue tout de même les enseignants de ce module, comme Aurélie Catel, qui faisait vraiment l'effort de nous vendre cette matière avec énergie et positivité.","5","4","6","Bon cours nous permettant de découvrir les technologies utilisées actuellement dans le monde de l'entreprise. C'est d'autant plus utile que le monde du réseau a une forte tendance a être présenté de manière historique, afin de comprendre comment il en est arrivé là aujourd'hui, mais qui de ce fait nous impose d'étudier des vieilles technologies qui ne sont même plus utilisées aujourd'hui (ou de manière marginale).

Le cours est un peu brouillon parfois, mais cela ne me déplaît pas car cela permet une certaine souplesse vis à vis du contenu du cours, et de s'intéresser à l'essentiel.","2","5","3","Soyons clairs, je n'aime pas ce cours. Cette évaluation ne porte pas sur les enseignants donc je ne m'étalerai pas sur le sujet, mais la pédagogie est tout de même clairement à revoir.

Pour le contenu du cours, je suis très dubitatif car je m'attendais à l'issue de ce cours à être capable d'estimer les performances d'un système donné, comme le laisse penser le nom du cours. Or si cet aspect pratique se retrouve lorsque les enseignants exposent l'idée du chapitre que l'on va aborder, dans les faits je n'ai aucune idée de comment appliquer le contenu du cours à la pratique, je n'ai tout simplement pas saisi le concept derrière le cours. A mes yeux, ceux sont justes des maths, et quelqu'un quelque part a pensé qu'il serait bien pour moi que je sache résoudre ces problèmes là. Qu'à cela ne tienne, nous sommes biens préparés pour l'examen, mais je n'en vois pas l'utilité.","5","6","6","Très bon projet !!! Complet, intéressant et enrichissant, il met en pratique de très nombreuses notions vues de manière théorique en 2A, ce qui fait un bien fou.
Seules deux petites remarques : On nous l'avait décrit comme nécessitant 25h de travail personnel par personne (groupe de 4), nous sommes plutôt sur un tarif de 100h par personne afin d'obtenir un rendu correct (et toujours pas parfait, hélas ...). Et parfois lorsque l'on pose une question sur un aspect pratique du protocole implémenté, on a l'impression d'apprendre quelque chose à l'enseignant (mais ça ne concerne que quelques aspects très spécifiques du protocole donné, rien de bien grave).","5","4","5","Matière (très) dense mais intéressante. Pour ma part c'est loin d'être le domaine qui m'attire le plus, pourtant je n'ai jamais eu aucun mal à m'intéresser au sujet pendant les cours, à en comprendre les enjeux et les raisonnements. Dans l'ensemble un bon cours.","4","3","6","A+ pour les TPs très enrichissants, d'autant plus que nous avions le temps de les finir ceux là !

Le cours est en revanche plus décevant de part sa lenteur : les diapositives ne sont pas assez complètes pour suffire à comprendre le protocole abordé, un TD de mise en pratique est nécessaire mais lorsqu'arrive ce TD, il n'est pas rare de faire 2~3 questions en 1h30, je pense clairement que l'on peut faire mieux que ça à un niveau Bac+5.","Oui","5","3","2","Le REX était une option ? tiens donc, on ne me l'avais clairement pas vendu comme tel...

Cela dit, le contenu était globalement satisfaisant, mais assez peu pertinent : je ne veux pas critiquer ici le cours dans son contenu ou son déroulement, mais vraiment dans le principe : il est extrêmement difficile de trouver un stage 2A, tout le monde saute sur la première proposition qu'il a car ça pourrait bien être la dernière, en dépit de l'intérêt qu'il porte au sujet du stage. Ainsi la plupart d'entre nous sont déçus ou peu fiers de leur stage 2A, et on nous impose de le partager avec les autres et de le défendre en en disant du bien.

Selon moi, il serait bénéfique de permettre à ce stage de durer moins de 8 semaines, ne serait-ce que 7, car 8 semaines impose à l'entreprise de nous payer un salaire, et le maximum de 13 semaines nous empêche d'apporter une véritable plus-value à l'entreprise. Même si certains préféreront gagner un salaire que de faire un travail intéressant, ce n'est pour ma part pas le cas et j'aurais aimé avoir ce choix (surtout qu'il s'agit de MA vie professionnelle...)","6","6","6","Je regrette que cette question ne soit pas scindée en deux parties, à l'image du cours : le cours est en effet scindé en une partie théorique, qui est très bien faite, et un projet qui est plutôt catastrophique (les notes attribuées ci-avant ne concernent d'ailleurs que le cours, le projet mérite un 0 pointé).

Explications : 
Pertinence du projet : moyenne, car il ne met tout simplement pas en place un système réparti ! Le projet consiste à mettre en place from scratch une boutique en ligne. Certes, cela PEUT être réparti, mais honnêtement, dans un projet étudiant tout sera toujours local, ne nous faisons pas d'illusions.

Accompagnement dans le projet : néant, le professeur évite les questions et ne réponds pas au mails, nous sommes purement et simplement seuls, sans même un tutoriel pour nous guider.

Cours initial expliquant les connaissances mises en place durant le projet : pitoyable, 45 minutes de cours pour faire le tour d'un projet qui doit durer tout un semestre. Tout bonnement inutile.

Seul aspect positif du projet : l'énoncé est détaillé en plusieurs étapes, qui nous aident au moins à voir la direction que l'on doit prendre.","Oui","3","5","2","Cf réponses du REX (vous auriez poser cette question ci avant celle du REX selon moi)","5","5","6","Mêmes remarques que pour réseaux satellites et cellulaires, un bon cours bien structuré qui a su m'intéresser alors que ce n'était pas acquis.","Oui","6","5","5","[Allemand] Un bon cours qui change du format classique des cours d'allemands, qui jusque là étaient tous similaires, depuis la quatrième jusqu'à la 2A. Je regrette juste que si peu d'élèves prennent cette option, car on ne peut de fait pas faire de groupes de niveaux.","Non","","","","","Non","","","","","Non","","","","","Oui","6","6","6","Très bon cours, donné sous un format intéressant. Il aide à vraiment comprendre l'enjeu du réseau et des télécoms et toute l'importance qu'ils peuvent avoir. Le nouveau mode d'évaluation est d'ailleurs très bénéfique selon moi, car il laisse aux étudiants la liberté d'approfondir l'aspect du cours qui les intéresse le plus.","Non","","","","","Non","","","","","Non","","","","","4","5","Le semestre est dense mais enrichissant, et on n'est pas non plus submergés par le travail. Le seul aspect que je regrette vraiment est que l'on a très peu de marge de manoeuvre quant au contenu de ce semestre, contrairement à la 2A où nous disposions d'un large éventail d'options. C'est d'autant plus dommage que c'est notre dernière année d'études, nous n'avons donc jamais été aussi proche du monde du travail, la grande majorité d'entre nous a donc déjà une idée précise de ce dans quoi il/elle compte travailler par la suite, et il serait donc intéressant de pouvoir approfondir ce domaine vis à vis des autres.

A cette fin, j'ai beaucoup apprécier l'idée d'un camarade, qui était d'autoriser des projets personnels : à l'instar de la vie associative en 2ème année qui peut rapporter des ECTS, nous pourrions en 3A faire valoir un projet personnel dans notre cursus, pour apprendre un langage donné ou une nouvelle technologie. Il suffirait ainsi de trouver un encadrant pour ce projet, comme on doit déjà le faire pour le PFE, qui pourrait ainsi s'assurer que nous avons effectivement travaillé pendant le semestre, voire nous aider en cas de blocage. 

Bien sûr, tout le monde ne serait pas intéressé par cette idée et cela devrait forcément être une option, mais ainsi laisser l'étudiant choisir entre un tel projet et une autre manière non principale de la filière, comme performances ou LV2/droit etc, serait selon moi un atout très intéressant du semestre."
"2017/02/06 10:34:41 am CET","5","5","5","","4","4","4","","4","4","4","","4","4","4","","4","4","4","","5","5","5","","4","4","4","","4","4","4","","6","6","6","","Non","","","","","4","4","4","","Non","","","","","4","4","4","","Non","","","","","Non","","","","","Non","","","","","Non","","","","","Oui","6","6","6","","Non","","","","","Non","","","","","Non","","","","","5","5",""