"Timestamp","5MMANGL6 - Qualité globale de l'enseignement :","5MMANGL6 - Qualité des supports de l'enseignement :","5MMANGL6 - Pertinence de l'enseignement dans le cursus:","5MMANGL6 - Commentaires:","5MMBDER6 - Qualité globale de l'enseignement :","5MMBDER6 - Qualité des supports de l'enseignement :","5MMBDER6 - Pertinence de l'enseignement dans le cursus:","5MMBDER6 - Commentaires:","5MMCTISS - Qualité globale de l'enseignement :","5MMCTISS - Qualité des supports de l'enseignement :","5MMCTISS - Pertinence de l'enseignement dans le cursus:","5MMCTISS - Commentaires:","5MMIM - Qualité globale de l'enseignement :","5MMIM - Qualité des supports de l'enseignement :","5MMIM - Pertinence de l'enseignement dans le cursus:","5MMIM - Commentaires:","5MMNAS6 - Qualité globale de l'enseignement :","5MMNAS6 - Qualité des supports de l'enseignement :","5MMNAS6 - Pertinence de l'enseignement dans le cursus:","5MMNAS6 - Commentaires:","5MMPERF6 - Qualité globale de l'enseignement :","5MMPERF6 - Qualité des supports de l'enseignement :","5MMPERF6 - Pertinence de l'enseignement dans le cursus:","5MMPERF6 - Commentaires:","5MMPRA3 - Qualité globale de l'enseignement :","5MMPRA3 - Qualité des supports de l'enseignement :","5MMPRA3 - Pertinence de l'enseignement dans le cursus:","5MMPRA3 - Commentaires:","5MMRCS - Qualité globale de l'enseignement :","5MMRCS - Qualité des supports de l'enseignement :","5MMRCS - Pertinence de l'enseignement dans le cursus:","5MMRCS - Commentaires:","5MMRDA6 - Qualité globale de l'enseignement :","5MMRDA6 - Qualité des supports de l'enseignement :","5MMRDA6 - Pertinence de l'enseignement dans le cursus:","5MMRDA6 - Commentaires:","5MMREX - Ce cours faisait-il partie de tes options ?","5MMREX - Qualité globale de l'enseignement :","5MMREX - Qualité des supports de l'enseignement :","5MMREX - Pertinence de l'enseignement dans le cursus:","5MMREX - Commentaires:","5MMSAR6 - Qualité globale de l'enseignement :","5MMSAR6 - Qualité des supports de l'enseignement :","5MMSAR6 - Pertinence de l'enseignement dans le cursus:","5MMSAR6 - Commentaires:","5MMSTAG - Ce cours faisait-il partie de tes options ?","5MMSTAG - Qualité globale de l'enseignement :","5MMSTAG - Qualité des supports de l'enseignement :","5MMSTAG - Pertinence de l'enseignement dans le cursus:","5MMSTAG - Commentaires:","5MMWIO - Qualité globale de l'enseignement :","5MMWIO - Qualité des supports de l'enseignement :","5MMWIO - Pertinence de l'enseignement dans le cursus:","5MMWIO - Commentaires:","5MMALL6 - Ce cours faisait-il partie de tes options ?","5MMALL6 - Qualité globale de l'enseignement :","5MMALL6 - Qualité des supports de l'enseignement :","5MMALL6 - Pertinence de l'enseignement dans le cursus:","5MMALL6 - Commentaires:","5MMAPSA - Ce cours faisait-il partie de tes options ?","5MMAPSA - Qualité globale de l'enseignement :","5MMAPSA - Qualité des supports de l'enseignement :","5MMAPSA - Pertinence de l'enseignement dans le cursus:","5MMAPSA - Commentaires:","5MMDROI6 - Ce cours faisait-il partie de tes options ?","5MMDROI6 - Qualité globale de l'enseignement :","5MMDROI6 - Qualité des supports de l'enseignement :","5MMDROI6 - Pertinence de l'enseignement dans le cursus:","5MMDROI6 - Commentaires:","5MMEPOL6 - Ce cours faisait-il partie de tes options ?","5MMEPOL6 - Qualité globale de l'enseignement :","5MMEPOL6 - Qualité des supports de l'enseignement :","5MMEPOL6 - Pertinence de l'enseignement dans le cursus:","5MMEPOL6 - Commentaires:","5MMISSI6 - Ce cours faisait-il partie de tes options ?","5MMISSI6 - Qualité globale de l'enseignement :","5MMISSI6 - Qualité des supports de l'enseignement :","5MMISSI6 - Pertinence de l'enseignement dans le cursus:","5MMISSI6 - Commentaires:","5MMSANG - Ce cours faisait-il partie de tes options ?","5MMSANG - Qualité globale de l'enseignement :","5MMSANG - Qualité des supports de l'enseignement :","5MMSANG - Pertinence de l'enseignement dans le cursus:","5MMSANG - Commentaires:","5MMTAND - Ce cours faisait-il partie de tes options ?","5MMTAND - Qualité globale de l'enseignement :","5MMTAND - Qualité des supports de l'enseignement :","5MMTAND - Pertinence de l'enseignement dans le cursus:","5MMTAND - Commentaires:","5MMTSL6 - Ce cours faisait-il partie de tes options ?","5MMTSL6 - Qualité globale de l'enseignement :","5MMTSL6 - Qualité des supports de l'enseignement :","5MMTSL6 - Pertinence de l'enseignement dans le cursus:","5MMTSL6 - Commentaires:","3AISSC - Le semestre passé a-t-il globalement correspondu à tes attentes ?","3AISSC - Les différents modules sont bien équilibrés.","3AISSC - Commentaires:"
"2017/01/18 10:27:24 am CET","6","6","6","Cours très intéressant qui m'a beaucoup plu !","5","4","5","","6","4","6","Très bénéfique de voir différents horizons de la filière","2","2","1","Perte de temps, trop de travail pour pas grand chose","3","4","4","","5","5","5","","5","6","6","","6","6","6","","6","6","6","Cours très bien construit et très clair","Oui","5","5","5","","2","2","4","Mes notes sont à nuancer. Nous avions 2 profs dans cette matière. Si j'avais du noter seulement O.Gruber j'aurais mis 6 mais la participation de N.DePalma fait grandement chuter les notes. En effet, ce dernier a eu un comportement très peu pédagogue, nous nous sommes retrouvés livrés à nous même dans un projet qui demandait une configuration complexe et qui nous donnait le premier lien de google lorsque l'on demandait de l'aide. Deplus pendant les heures normalement dédiées à la réalisation du projet, nous nous sommes retrouvé avec d'autres cours (??) réalisés par un intervenant appelé par DePalma sans aucun lien avec la matière ou le projet...
La partie cours réalisée par Monsieur Gruber était quant à elle très intéressante et bien menée !","Oui","5","5","5","","4","4","6","","Non","","","","","Non","","","","","Oui","6","6","6","","Non","","","","","Oui","5","6","6","","Non","","","","","Non","","","","","Non","","","","","5","5",""
"2017/01/18 10:56:07 am CET","4","5","3","A partir d'un certain niveau en anglais, je pense que les élèves sont capables d'entretenir leur niveau par leurs propres moyens (séries, films, etc.) et que ces cours deviennent plus culturels et dédiés à l'expression oral en général que vraiment dédiés à l'apprentissage de la langue. Ils demandent souvent un grand investissement pour un cours dont on ne ressent pas forcément l'utilité... Pourquoi ne pas directement dispenser des cours de culture ou d'expression oral pour ceux qui le voudraient ?","5","4","5","Très bon cours, très bien enseigné","4","1","4","Assez intéressant, mais absence de supports (slides par exemple) si on a manqué une conférence","3","3","2","Ce cours devrait être une option réservée aux étudiants intéressés, car le fait d'être en groupe avec des personnes complètement désintéréssées peut freiner le travail et l'envie de certaines personnes. De plus, ce cours demande beaucoup d'investissement compte tenu de la notation floue et de l'intérêt porté à cette matière par la majorité des élèves.","4","5","4","Cours de culture générale sur les nouvelles architectures de service, difficile d'imaginer un TD ou un partiel à ce sujet. Beaucoup d'informations sont données en même temps, ce qui peut rendre les concepts un peu flous.","4","5","5","Le cours est plutôt clair, et la présence de TD à réaliser en groupe et à rendre aide à fixer les notions et à s'entrainer. Parfois, la différence d'exigence et de niveau est un peu trop grande entre ce qui a été vu en cours et ce qui est demandé en TD.","4","5","5","Projet exigeant mais très intéressant à réaliser pour des étudiants de la filière ISSC.","3","4","4","Très flou, beaucoup de notions vagues et énormément d'informations distribuées à la fois. Absence de TD.","6","6","6","Très bien enseigné avec un très bon professeur qui fait des TD très clairs.","Oui","4","3","4","Assez intéressant, dommage que la note ne nous parvienne pas au moment où on rend le rapport car on oublie ensuite très vite ce que l'on a vu et ce que l'on a réalisé","2","4","2","Ce cours a été divisé en 3 parties : l'une ""enseignée"" par N. De Palma, une autre par O. Gruber, et enfin une dernière par B. Saccucci.
- Le cours dispensé par Olivier Gruber mérite la note maximale pour tous les critères : très clair, très bien expliqué, rien à redire.
- En ce qui concerne le ""cours"" de N. De Palma et B. Saccucci (qui n'a d'ailleurs jamais été inscrit sur l'emploi du temps) : nous avons vu N. De Palma une seule fois, lors de la 1ère séance où il nous a fait un cours rapide sur JEE et nous a ensuite présenté un projet à réaliser en groupe. Il s'est ensuite installé à son bureau avec ses écouteurs et nous ne l'avons plus revu.
Lors des séances suivantes, absence de professeur. Un jour, nous avons reçu un mail de B. Saccucci, disant que nous aurions cours avec lui sur le créneau de SAR les prochaines semaines. Nous l'avons donc vu, présenter son logiciel Qlik et nous apprendre à l'utiliser (ce qui n'a d'ailleurs rien à voir avec les systèmes et applications réparties) pendant quelques séances. Puis de nouveau, plus personne. Nous devons apparemment avoir une soutenance à faire sur ce logiciel Qlik, mais aucune nouvelle. En ce qui concerne le projet de N. De Palma, nous n'avons jamais eu plus d'informations et les quelques élèves qui ont tenté de le contacter se sont heurtés à son indifférence. Ce cours est donc dans le flou le plus total et nous n'avons pas l'impression d'avoir appris quoi que ce soit grâce à Mr De Palma, car la configuration de son projet est extrêmement compliquée et il ne s'est jamais montré enclin à nous aider.

Seule la partie de cours dispensée par Olivier Gruber était donc réellement pertinente dans ce cours, les autres professeurs ne nous ont rien appris. Le fait d'apprendre JEE est intéressant, surtout lorsque l'on recherche un PFE, mais peut-être cela devrait-il être réalisé dans un cours différent, et surtout par un autre enseignant.","Oui","4","4","4","Les notes sont arbitraires étant donné que nous n'avions pas de cours à proprement parler. La soutenance s'étant déroulée en septembre, peut-être aurait-il été intéressant d'avoir les retours et les notes tout de suite après, plutôt que plus tard dans l'année (quand, d'ailleurs ?), maintenant que nous avons en grande partie oublié ce que nous avons fait.","4","5","5","Assez intéressant, la partie par Michel Ayraud est plutôt bien réalisée, celle par Martin Heusse est plutôt floue et difficile à suivre.","Non","","","","","Non","","","","","Oui","6","6","5","Cours très intéressant et très bien réalisé. Dommage pour l'horaire rébarbatif (lundi 17h-18h30) qui a démotivé pas mal d'étudiants, et qui a sûrement dû inciter l'enseignante à se remettre en question alors qu'elle n'y était pour rien.","Non","","","","","Oui","5","5","5","Très intéressant, un peu difficile à suivre par moments (cryptographie).
Système de notation ludique et bien réalisé, plus intéressant qu'un partiel classique.","Non","","","","","Non","","","","","Non","","","","","4","3","Quelques cours sont vraiment chaotiques et difficiles à suivre, d'autres vraiment intéressants et à conserver pour les prochaines années."
"2017/01/18 11:01:15 am CET","5","5","5","","4","4","4","","5","5","5","","5","5","4","","5","5","5","","5","5","5","","5","5","5","","5","5","5","","5","5","5","","Oui","5","5","5","","3","3","3","Matière à double tranchant. Très bon cours et TD de Mr Gruger. Mais à côté de ça projet débile et prof inexistant ","Oui","5","5","6","","5","5","5","","Oui","5","5","5","","Non","","","","","Non","","","","","Non","","","","","Oui","5","5","5","","Non","","","","","Non","","","","","Non","","","","","4","4",""
"2017/01/18 12:28:57 pm CET","6","6","6","Le module sur les speechs était très réussi !","5","5","6","Le cours est intéressant et bien illustré par la plupart des TPs (pas le dernier malheureusement). M.Bobineau est juste un peu réticent à répondre aux questions des étudiants et nous laisse un peu livrés à nous-mêmes pendant les TPs.","3","3","5","De qualités inégales. Certains intervenants étaient vraiment soporifiques. Et je pense qu'il faudrait changer un peu la notation. Pas demander un rapport pour chaque conférence mais par exemple un rapport pour les deux que l'on a préférées. On a tous des conférences qui nous ont déplus. Et c'est dommage de forcer des étudiants à dépenser du temps et de l'énergie pour des conférences qui ne les intéressent pas.","1","4","1","Ce cours est vraiment inintéressant. Personne n'y croît. On essaie de jouer le jeu parce qu'on sait qu'on va être notés dessus mais personne ne souhaite vraiment se donner à cet exercice.
Qui plus est, ce cours est extrêmement redondant avec le projet CECA de l'année dernière. Sauf qu'au moins en CECA, on avait la liberté de choisir notre sujet. Ici, le sujet était imposé, ce qui ne stimulait absolument pas notre créativité, ce qui est problématique pour un cours d'innovation.
Et je cherche encore la partie management...","3","3","6","Là, c'est le contraire ! Sur le principe, le cœur du cours me parle. Mais Planat est tellement soporifique que j'ai du mal à m'y intéresser. Pourtant, c'est le seul cours qui nous parle des technos d'aujourd'hui !! Et ça, dans l'esprit, c'est vraiment génial. Parce que l'une des choses que je reproche à l'ensemble de nos cours c'est de nous enseigner des technos un peu vieillottes, pas d'actualité au vu de ce qu'on nous demandera de faire en tant qu'ingénieurs.","6","6","5","Bon cours. Ça fait du bien de faire un peu de maths. Les cours sont bien (le prof est un peu sec mais au moins il est efficace, ça rappelle la prépa !), les TDs sur machine aussi.","5","3","6","Le projet était vraiment intéressant et plutôt bien suivi. Je suis juste déçu de ne pas avoir pu finir aussi près du but. Et ça, c'était surtout dû au fait qu'on ne s'est pas mis au boulot assez vite. Donc s'ils pouvaient être un peu plus chiants avec les étudiants dès le début, je pense que ça nous aiderait globalement à finir dans les temps !","4","4","3","Le sujet ne m'intéresse pas. Mais malgré cela, je pense que Heusse fait bien son cours (il est passionné et ça se voit, et puis j'aime bien ses petites blagues). Alphand est un moins bon orateur, on peut s'ennuyer un peu pendant ses cours mais rien de bien alarmant, il maîtrise quand même bien son sujet.","4","5","5","Je ne comprends pas comment ce cours très facile fait pour valoir autant d'ECTS. Je ne vais pas m'en plaindre parce que je pense que cela va bien m'aider pour valider mon année ! Mais je suis pas tout à fait sûr que ce soit très pertinent.
Autrement, le problème de ce cours, c'est que le prof va trop lentement. Ce qu'il explique est simple. Mais quand on passe aux exercices, on peut passer 1h à faire la correction d'un exercice que l'on a fait nous en 10 minutes. Mais la matière reste intéressante !","Oui","4","3","5","C'était très intéressant d'entendre les expériences des autres. C'est très bien que le REX soit pour le stage de 2A et pas le stage de 1A (comme à Phelma !)","3","3","5","O. Gruber :
Gruber est un bon prof ! Je le trouve juste un peu optimiste d'attendre de ses élèves qu'ils soient proactifs pendant le cours. C'est peut-être dommage mais je pense que ça n'arrivera jamais.
Très bon cours.

N. De Palma :
M. De Palma est une énorme fumisterie. J'espère qu'il n'est pas rémunéré pour toutes les heures qui figurent dans notre emploi du temps car cela serait un comble !
Ces cours n'en sont pas. Certes, lors de la première séance, il nous a expliqué des notions avec des transparents (mais en étant bien trop technique et en allant beaucoup trop vite pour nous) mais au moins, lors de cette séance, il a eu le mérite de faire un semblant de cours. Parce qu'une fois son explication finie, nous avons été livrés à nous-mêmes pour aborder un projet très mal défini.
Alors encore, je comprends que l'on attende des étudiants qu'ils soient autonomes en 3A sur un projet de ce type. Mais le problème, c'est que nous n'avons pas eu de cadre DU TOUT. Même lorsque nous allions voir M. De Palma pour lui poser des questions un peu techniques, il refusait le dialogue, étant absorbé par son smartphone, et restait extrêmement vague. Vague au point qu'aller lui poser des questions ne nous apportait aucune réponse.
Par ailleurs, il n'y a pas eu de suivi de projet, il ne passait même pas entre les rangs pour voir si l'on avançait ou pas !
Bref, je n'ai personnellement toujours pas compris comment marchaient les java beans. Et je suis persuadé que j'aurais plus appris en travaillant en autodidacte sur un projet perso pour apprendre une nouvelle techno (nouveau langage, nouveau framework, ...) qu'avec ce cours. Et quand un cours est moins bon qu'un apprentissage en autodidacte, il est légitime de remettre en question ce cours.

B. Sacucci :
Ce cours est une vaste plaisanterie. Je ne comprends pas comment l'ENSIMAG permet ce genre de choses au sein de leurs locaux.
Il est évident que Qlick vient donner ce cours en étant intéressé. Ils cherchent à familiariser les étudiants à leur plateforme afin d'obtenir de nouveaux clients lorsqu'ils seront diplômés. Il est parfaitement normal qu'ils agissent ainsi, c'est une entreprise qui cherche à maximiser son profit et qui va pour cela chercher des potentiels acheteurs là où elle le pourra.
Non, ce qui ne va pas, c'est que l'ENSIMAG permette cela !! (A voir si l'ENSIMAG est au courant de ça ! Parce que connaissant De Palma, c'est pas dit.) Ce cours n'est pas là pour enseigner de nouvelles connaissances aux étudiants mais pour leur faire plus ou moins manipuler un logiciel hyper spécifique qui ne leur servira jamais s'ils ne réutilisent pas ce logiciel précis. Hors, ce que l'on est censés apprendre à l'ENSIMAG, c'est au contraire d'apprendre des notions assez générales pour que l'on puisse s'adapter à tout logiciel/SI.
Bref, ce prof est dans un tel conflit d'intérêt que je ne vois pas comment il peut apporter quoi que ce soit d'intéressant aux étudiants.
Et puis quel est le rapport avec la matière ?!","Oui","6","6","6","Le stage 2A quoi ! Hyper formateur et nous permettant de nous spécialiser.
Indispensable.","3","3","1","Là aussi, le sujet ne m'intéresse pas. Mais absolument pas. Ça n'a rien à voir avec ce que je vais faire en stage, avec ce que je veux faire plus tard ni avec ce que je vais faire plus tard.
Le prof (malgré les remarques sexistes récurrentes) parle bien mais son cours est trop technique.","Non","","","","","Non","","","","","Oui","4","4","5","Je n'ai jamais pu aller à ce cours car il était en conflit avec mes activités associatives (qui avaient clairement la priorité). C'est dommage, le sujet m'intéressait !","Non","","","","","Oui","5","5","5","Bon cours, prof ouvert.","Non","","","","","Non","","","","","Non","","","","","4","1","Quels modules ? On n'a quasiment pas de choix en ISSC !!
Moi je sais que je voulais faire du web depuis l'année dernière et je me retrouve forcé à étudier des matières trop bas niveau qui ne me serviront jamais.
Faites des modules !!"
"2017/01/19 5:15:33 pm CET","4","2","5","Il y a deux types de personnes en ISSC : ceux qui sont très télécoms et ceux qui sont plus developpement logiciel et web. Il faudrait peut-etre avoir plus de cours en options pour avoir des cours en meilleur adéquation. Pour la qualité des supports, des cours qui font des milliers de diapos c'est quand même pas terrible,...","3","2","5","Cours beaucoup trop théorique : bon point pour les tps qui sauvent la matière. Diapos ennuyeuses et beaucoup top nombreuses.","5","4","6","","3","3","4","A modifier pour le rendre vraiment pertinent","4","4","4","Ce qui est dommage c'est que c'est que ce n'est qu'une longue description de ce qui existe depuis 15 ans","4","4","4","Pour la pertinence, il faudrait justement que cela soit vraiment bien appliqué à des cas très concrets et sortir de la théorie pour faire de la théorie.","5","5","6","","4","5","5","","3","4","5","","Oui","4","4","5","","3","3","6","Le cours est en 3 parties : partie d'Olivier Gruber bien mais il manque l'implémentation de ce qui est vu en cours. Partie de  De Noël palma : prof absent, on a pas vraiment eu cours. Partie sur Qlick : être moins sur la description mais plus sur le fonctionnement du logiciel. ","Oui","6","6","6","","5","5","6","Malgré tout je pense que la partie IoT pourrait prendre plus de place dans les années à venir avec une vraie description de LoRa et Sigfox.","Oui","4","4","5","Langue : allemand.","Non","","","","","Non","","","","","Non","","","","","Non","","","","","Non","","","","","Non","","","","","Oui","4","4","5","Cours intéressant, trop théorique sans avoir vraiment de projets qui permettent de mettre en oeuvre ce qu'on a vu. Sinon partie ihm assez inutile.","4","2","Beaucoup de cours tournés vers les télécoms : beaucoup de personnes à la sortie vont plutot faire du developpement logiciel ou web avec eventuellement du reseau. Il faudrait rééquilibré un peu dans ce sens pour être vraiment bien préparé par la suite."
